title,author,year,genres,tropes,vibes,heat,pacing,format_availability,ku,audio,pages,content_notes,comps,hook_line,why_readers_might_like
The Maid's Secret,Shari J. Ryan,2021,WWII historical fiction|women's fiction,found family|dual timeline,bittersweet|hopeful,closed,steady,ebook|paperback,True,False,350,war violence (off-page); child endangerment (resolved),The Nightingale|Lilac Girls,A mother-daughter secret bridges war-torn lives.,Emotion-forward WW2 with hope; great for readers who want sisterhood and survival without graphic scenes.
A Quiet Death in Cotswold,Jane Willow,2023,cozy mystery,amateur sleuth|bookshop setting,cozy|witty,closed,steady,ebook|paperback|audio,False,True,290,no gore; mild peril,The Thursday Murder Club|Ellie Alexander,Bookshop owner solves village mystery with found family.,"Gentle stakes, banter, and puzzle-first mystery; zero pet peril."
Starlight Heist,Rey Calder,2022,science fiction|space opera,heist crew|found family,high-octane|witty,fade,fast,ebook|audio,False,True,360,violence (PG-13),The Long Way to a Small Angry Planet|Six of Crows,A ragtag crew pulls an impossible score between rival planets.,"For readers who want banter, momentum, and a lovable crew dynamic."
Undercover Heart,M. Vale,2020,romantic suspense,grumpy sunshine|forced proximity,gritty|tender,open,fast,ebook|paperback|audio,True,True,330,"abduction (off-page), violence (moderate)",Nora Roberts romantic suspense,Bodyguard and witness on the run catch feelings between near-misses.,Delivers adrenaline + romance with a satisfying HEA.
The Clockmaker’s Niece,E. Harland,2019,historical fiction|mystery,secret identity|forbidden love,bittersweet|atmospheric,closed,steady,ebook|paperback,False,False,340,war trauma (off-page),The Alice Network|The Light Over London,A 1940s apprentice uncovers a spy ring through clockwork clues.,Dual-timeline mystery with soft romance and strong female lead.
